<?xml version="1.0" encoding="UTF-8"?>
<discoteca xmlns:xsi="http://www.w3.org/2001/XMLSchema-instance"
xsi:noNamespaceSchemaLocation="discoteca.xsd">
 <cancion>
 <titulo>Las nanas de la cebolla</titulo>
 <autor>
 <letra>Miguel Hernández</letra>
 <musica>Joan Manuel Serrat</musica>
 </autor>
 <interprete solista="si">Joan Manuel Serrat</interprete>
 <estilo>cantautor</estilo>
 <promocion>
 <festival>
 <ciudad>Tarragona</ciudad>
 </festival>
 </promocion>
 </cancion>

 <cancion>
 <titulo>Comandante Marcos</titulo>
 <autor>
 <letra>Joaquín Sabina</letra>
 <letra>Comandante Marcos</letra>
 <musica>Desconocido</musica>
 </autor>
 <interprete>Joaquín Sabina</interprete>
 <estilo>canción canallesca</estilo>
 <promocion>
 <radio>
 <emisora>radio OLE</emisora>
 <emisora>M80</emisora>
 </radio>
 </promocion>
 </cancion>

 <cancion>
 <titulo>Paseo con la negra flor</titulo>
 <autor>
 <letra>Santiago Serón</letra>
 <musica>Santiago Serón</musica>
 <musica>Alberto Múgica</musica>
 </autor>
 <interprete solista="no">Radio Futura</interprete>
 <promocion>
 <radio>
 <emisora>Radio 3</emisora>
 </radio>
 </promocion>
 </cancion>

</discoteca>
